{
  "schema_version": "0.1",
  "artifact_kind": "ledger_entry",
  "timestamp": "2026-02-11T18:30:00Z",
  "run_id": "run-2026-02-11-001",
  "iteration_id": "iter-0003",
  "phase": "GATE",
  "decision": "DENY",
  "reason_codes": [
    "TESTS_FAILED"
  ],
  "out_dir": "out/xtrl/pkt-loop-0010",
  "base_ref": "origin/main"
}
